{
  "caption": "Server",
  "name": "server",
  "description": "The Server object describes the server responding to a client request.",
  "attributes": {
    "name": {
      "description": "The name of the server.",
      "requirement": "optional"
    },
    "os": {
      "requirement": "optional"
    },
    "product": {
      "requirement": "optional"
    },
    "version": {
      "description": "The server protocol version.",
      "requirement": "recommended"
    },
    "uid": {
      "description": "The unique server identifier.",
      "requirement": "required"
    }
  }
}