{
  "caption": "Distributed Computing Environment/Remote Procedure Calls (DCE/RPC)",
  "name": "dce_rpc",
  "description": "The DCE/RPC object describes the remote procedure call system for distributed computing environments.",
  "attributes": {
    "flags": {
      "description": "The list of interfaces",
      "requirement": "required"
    },
    "network_interfaces": {
      "description": "The list of DCE/RPC interfaces",
      "requirement": "optional"
    }
  }
}